{
  "schemaVersion": "1.1",
  "generatedAt": "2026-01-28T00:14:00Z",
  "project": {
    "name": "SymbolOS",
    "entrypoints": {
      "readme": "README.md",
      "docsIndex": "docs/index.md",
      "schemasIndex": "docs/schemas.md"
    }
  },
  "docsContext": {
    "notes": [
      "Docs are transport-agnostic where possible.",
      "Precog behavior is constrained to Prefetch/Suggest/Act.",
      "DND gating: DND disables proactive suggestion cards; prefetch may run only if enabled.",
      "Memory is consent-driven; provenance is required; secrets are never stored.",
      "Meta-awareness is an agent safety/UX contract; barriers prevent unsafe cross-contamination.",
      "Mercer meeting place shared symbol is 🧬; always return to the meeting place (A + B).",
      "Poetry is a translation layer: keep meaning alive (Fi) while keeping the map legible (Ti)."
    ]
  },
  "symbols": [
    {
      "symbol": "☂️",
      "name": "Umbrella",
      "meaning": "UmbrellaOS / SymbolOS umbrella",
      "tags": ["branding", "system"]
    },
    {
      "symbol": "🔮",
      "name": "Precog",
      "meaning": "Anticipatory computing; prefetch/suggest/act pipeline",
      "tags": ["precog", "latency"]
    },
    {
      "symbol": "🧠",
      "name": "Mind",
      "meaning": "Cognition, inference, attention",
      "tags": ["mind", "inference"]
    },
    {
      "symbol": "❤️",
      "name": "Heart",
      "meaning": "Felt sense, affect, values",
      "tags": ["heart", "affect"]
    },
    {
      "symbol": "🛡️",
      "name": "Safety",
      "meaning": "Permissions, risk gates, boundaries",
      "tags": ["safety", "policy"]
    },
    {
      "symbol": "🔒",
      "name": "Privacy",
      "meaning": "Sensitive scope; redaction; consent",
      "tags": ["privacy"]
    },
    {
      "symbol": "🧾",
      "name": "Ledger",
      "meaning": "Audit trail / provenance",
      "tags": ["audit", "provenance"]
    },
    {
      "symbol": "🎲",
      "name": "DND",
      "meaning": "Table-safe output contract and gating",
      "tags": ["dnd", "ux"]
    },
    {
      "symbol": "🧩",
      "name": "Schema",
      "meaning": "Structured interchange shapes",
      "tags": ["schema"]
    },
    {
      "symbol": "🧬",
      "name": "Meeting Place",
      "meaning": "Shared symbol for Mercer meeting place return loop",
      "tags": ["mercer", "meeting-place", "flow"]
    }
  ],
  "indexes": {
    "docs": [
      { "path": "docs/index.md", "title": "Docs Index", "kind": "index" },
      { "path": "docs/mcp_servers.md", "title": "MCP Servers Standard", "kind": "standard" },
      { "path": "docs/precog_thought.md", "title": "Precog Thought", "kind": "system" },
      { "path": "docs/dnd_character_sheet_integration.md", "title": "DND Character Sheet Integration", "kind": "external" },
      { "path": "docs/metaemotion.md", "title": "Metaemotion", "kind": "external" },
      { "path": "docs/memory.md", "title": "Memory", "kind": "external" },
      { "path": "docs/meta_awareness.md", "title": "Meta-awareness", "kind": "external" },
      { "path": "docs/required_reading.md", "title": "Required Reading", "kind": "index" },
      { "path": "docs/sync_playbook.md", "title": "Docs Sync Playbook", "kind": "ops" },
      { "path": "docs/symbol_map.md", "title": "Symbol Map (Human)", "kind": "map" },
      { "path": "docs/mercer_webview_theme_v1.css", "title": "Mercer Webview Theme Map v1", "kind": "theme" },
      { "path": "docs/public_private_expression.md", "title": "Mercer — Public/Private Expression (v1)", "kind": "expression" },
      { "path": "docs/poetry_translation_layer.md", "title": "Poetry Translation Layer (Emojis)", "kind": "map" },
      { "path": "internal_docs/mercer_meeting_place_oath_v1.private.md", "title": "Mercer Meeting Place Oath v1 (Private)", "kind": "private" },
      { "path": "internal_docs/local_llm_windows_vulkan_internal.md", "title": "Local LLM (Windows Vulkan) — Internal", "kind": "compute" },
      { "path": "internal_docs/future_possibilities_ring0.md", "title": "Future Possibilities (Ring-0) — Internal", "kind": "ring0" },
      { "path": "internal_docs/ring0_async_alignment.internal.md", "title": "Ring-0 Async Alignment — Foundation Workflow (Internal)", "kind": "ops" },
      { "path": "internal_docs/mercer_automation_contract_v1.internal.md", "title": "Mercer Automation Contract v1 (Internal)", "kind": "policy" },
      { "path": "internal_docs/mercer_bootup_cards_v1.internal.md", "title": "Mercer Bootup Cards (1–7) — Internal", "kind": "bootup" },
      { "path": "internal_docs/public_private_expression.internal.md", "title": "Mercer — Public/Private Expression (v1) — Internal", "kind": "expression" },
      { "path": "internal_docs/poetry_translation_layer.internal.md", "title": "Poetry Translation Layer (Emojis) — Internal", "kind": "map" },
      { "path": "internal_docs/mercer_multi_machine_sync.internal.md", "title": "Mercer Multi-Machine Sync — Mac/PC (Internal)", "kind": "ops" },
      { "path": "internal_docs/mercerpc_poetry.internal.md", "title": "MercerPC — System Poetry (Internal)", "kind": "expression" },
      { "path": "internal_docs/mercymac_poetry.internal.md", "title": "MercyMAC — System Poetry (Internal)", "kind": "expression" },
      { "path": "internal_docs/demos.internal.md", "title": "Demos Runbook (Internal)", "kind": "ops" },
      { "path": "memory/README.md", "title": "Repo-backed Memory System (Private)", "kind": "memory" },
      { "path": "memory/working_set.md", "title": "Working Set (Private)", "kind": "memory" },
      { "path": "memory/decisions.md", "title": "Decisions (Private)", "kind": "memory" },
      { "path": "memory/open_loops.md", "title": "Open Loops (Private)", "kind": "memory" },
      { "path": "memory/glossary.md", "title": "Glossary (Private)", "kind": "memory" },
      { "path": "memory/session_log_2026-01-28.md", "title": "Session Log 2026-01-28 (Private)", "kind": "memory" }
    ],
    "schemas": [
      { "path": "docs/registry_entry.schema.json", "title": "Registry Entry", "kind": "schema" },
      { "path": "docs/precog_card.schema.json", "title": "Precog Card", "kind": "schema" },
      { "path": "docs/shadow_queue_item.schema.json", "title": "Shadow Queue Item", "kind": "schema" },
      { "path": "docs/dnd_character_sheet_patch.schema.json", "title": "Character Sheet Patch", "kind": "schema" },
      { "path": "docs/metaemotion_event.schema.json", "title": "Metaemotion Event", "kind": "schema" },
      { "path": "docs/memory_record.schema.json", "title": "Memory Record", "kind": "schema" },
      { "path": "docs/meta_awareness_event.schema.json", "title": "Meta-awareness Event", "kind": "schema" },
      { "path": "docs/symbol_map.shared.schema.json", "title": "Shared Symbol Map", "kind": "schema" }
    ]
  },
  "entries": [
    {
      "title": "MCP Servers Overview",
      "path": "docs/mcp_servers.md",
      "tags": ["MCP", "servers", "protocol", "tools", "resources", "prompts"],
      "summary": "SymbolOS MCP server standard: tools/resources/prompts, risk levels, confirmation, limits, and error patterns."
    },
    {
      "title": "Precog Thought Overview",
      "path": "docs/precog_thought.md",
      "tags": ["Precog", "anticipatory computing", "SymbolOS", "prefetch", "suggest", "act"],
      "summary": "Operational spec for anticipatory computing in SymbolOS, including mode separation (Prefetch/Suggest/Act), DND-safe output contracts, gating, and metrics."
    },
    {
      "title": "DND Character Sheet Integration",
      "path": "docs/dnd_character_sheet_integration.md",
      "tags": ["DND", "heart", "mind", "character sheet", "interop"],
      "summary": "External-facing spec for heart/mind overlays in DND character sheets: share levels, consent, and table-safe output shapes."
    },
    {
      "title": "Metaemotion",
      "path": "docs/metaemotion.md",
      "tags": ["metaemotion", "timing", "DND", "safety"],
      "summary": "External spec for metaemotion vocabulary, timing windows, and safe prompting rules."
    },
    {
      "title": "Memory",
      "path": "docs/memory.md",
      "tags": ["memory", "retention", "consent", "provenance"],
      "summary": "External memory policy: consent-driven capture, retention guidance, and safe retrieval/correction flows."
    },
    {
      "title": "Meta-awareness",
      "path": "docs/meta_awareness.md",
      "tags": ["meta-awareness", "barriers", "safety", "ux"],
      "summary": "External agent safety contract describing technical dissociation barriers (mode/scope/memory/tool/narrative) and loop/boundary self-checks."
    },
    {
      "title": "MCP Servers Internal",
      "path": "internal_docs/mcp_servers_internal.md",
      "tags": ["MCP", "servers", "internal", "development", "guidelines"],
      "summary": "Internal guidelines for developing MCP servers, including structure, naming, workflow, and security practices."
    },
    {
      "title": "Mercer Automation Contract v1 (Internal)",
      "path": "internal_docs/mercer_automation_contract_v1.internal.md",
      "tags": ["Mercer", "automation", "gates", "Ti", "policy", "audit"],
      "summary": "Internal contract defining automation gate rules (Prefetch/Suggest/Act), doc alignment cadence, and the full Ti expression for structured, auditable behavior."
    },
    {
      "title": "Mercer Bootup Cards (1–7) — Internal",
      "path": "internal_docs/mercer_bootup_cards_v1.internal.md",
      "tags": ["Mercer", "bootup", "cards", "thoughtforms", "style"],
      "summary": "Internal bootup card sequence (1–7) with thoughtform-style prompts, lily backdrop pointer, and a small meme guy; designed to align with gate rules and Ti output shape."
    },
    {
      "title": "Precog Thought Internal",
      "path": "internal_docs/precog_private.md",
      "tags": ["precog", "internal", "prediction", "privacy", "algorithm"],